{
  "resourceType" : "PractitionerRole",
  "id" : "PFEIG-Role-OT-DanielGranger",
  "text" : {
    "status" : "generated",
    "div" : "<div xmlns=\"http://www.w3.org/1999/xhtml\"><p class=\"res-header-id\"><b>Generated Narrative: PractitionerRole PFEIG-Role-OT-DanielGranger</b></p><a name=\"PFEIG-Role-OT-DanielGranger\"> </a><a name=\"hcPFEIG-Role-OT-DanielGranger\"> </a><a name=\"PFEIG-Role-OT-DanielGranger-en-US\"> </a><p><b>active</b>: true</p><p><b>practitioner</b>: <a href=\"Practitioner-PFEIG-Practitioner-DanielGranger.html\">Practitioner Daniel Granger</a></p><p><b>organization</b>: <a href=\"Organization-PFEIG-Org-02.html\">Organization Happy Nursing Facility</a></p><p><b>code</b>: <span title=\"Codes:{http://snomed.info/sct 80546007}\">Occupational therapist</span></p><p><b>location</b>: <a href=\"Location-PFEIG-Org-Loc-02.html\">Location Happy Nursing Facility</a></p></div>"
  },
  "active" : true,
  "practitioner" : {
    "reference" : "Practitioner/PFEIG-Practitioner-DanielGranger"
  },
  "organization" : {
    "reference" : "Organization/PFEIG-Org-02"
  },
  "code" : [{
    "coding" : [{
      "system" : "http://snomed.info/sct",
      "code" : "80546007",
      "display" : "Occupational therapist"
    }]
  }],
  "location" : [{
    "reference" : "Location/PFEIG-Org-Loc-02"
  }]
}