{
  "resourceType": "PractitionerRole",
  "id": "PractitionerRole-DNP-JudySalas", "telecom": [{"system": "phone", "value": "(555) 944-2454"}, {"system": "email", "value": "jsalas@MotownHHA.com"}],
  "text": {
    "status": "generated",
    "div": "<div xmlns=\"http://www.w3.org/1999/xhtml\"><p class=\"res-header-id\"><b>Generated Narrative: PractitionerRole PractitionerRole-DNP-JudySalas</b></p><a name=\"PractitionerRole-DNP-JudySalas\"> </a><a name=\"hcPractitionerRole-DNP-JudySalas\"> </a><p><b>active</b>: true</p><p><b>practitioner</b>: <a href=\"Practitioner-Practitioner-JudySalas.html\">Judy Salas</a></p><p><b>organization</b>: <a href=\"Organization-org-Motown-Home-Health.html\">Motown Home Health Agency</a></p><p><b>code</b>: <span title=\"Codes:{http://nucc.org/provider-taxonomy 363L00000X}\">Nurse Practitioner</span></p><p><b>location</b>: <a href=\"Location-org-Loc-Motown-Home-Health.html\">Location Motown Home Health</a></p></div>"
  },
  "active": true,
  "practitioner": {
    "reference": "Practitioner/Practitioner-JudySalas",
    "display": "Judy Salas"
  },
  "organization": {
    "reference": "Organization/org-Motown-Home-Health",
    "display": "Motown Home Health Agency"
  },
  "code": [
    {
      "coding": [
        {
          "system": "http://nucc.org/provider-taxonomy",
          "code": "363L00000X",
          "display": "Nurse Practitioner"
        }
      ]
    }
  ],
  "location": [
    {
      "reference": "Location/org-Loc-Motown-Home-Health"
    }
  ]
}