{
  "resourceType" : "PractitionerRole",
  "id" : "PFEIG-Role-SNFDoc-GeraldPark",
  "text" : {
    "status" : "generated",
    "div" : "<div xmlns=\"http://www.w3.org/1999/xhtml\"><p class=\"res-header-id\"><b>Generated Narrative: PractitionerRole PFEIG-Role-SNFDoc-GeraldPark</b></p><a name=\"PFEIG-Role-SNFDoc-GeraldPark\"> </a><a name=\"hcPFEIG-Role-SNFDoc-GeraldPark\"> </a><a name=\"PFEIG-Role-SNFDoc-GeraldPark-en-US\"> </a><p><b>active</b>: true</p><p><b>practitioner</b>: <a href=\"Practitioner-PFEIG-Practioner-GeraldPark.html\">Gerald Park</a></p><p><b>organization</b>: <a href=\"Organization-PFEIG-Org-02.html\">Happy Nursing Facility</a></p><p><b>code</b>: <span title=\"Codes:{http://nucc.org/provider-taxonomy 207QG0300X}\">Geriatric Medicine (Family Medicine) Physician</span></p><p><b>location</b>: <a href=\"Location-PFEIG-Org-Loc-02.html\">Location Happy Nursing Facility</a></p></div>"
  },
  "active" : true,
  "practitioner" : {
    "reference" : "Practitioner/PFEIG-Practioner-GeraldPark",
    "display" : "Gerald Park"
  },
  "organization" : {
    "reference" : "Organization/PFEIG-Org-02",
    "display" : "Happy Nursing Facility"
  },
  "code" : [{
    "coding" : [{
      "system" : "http://nucc.org/provider-taxonomy",
      "code" : "207QG0300X",
      "display" : "Geriatric Medicine (Family Medicine) Physician"
    }]
  }],
  "location" : [{
    "reference" : "Location/PFEIG-Org-Loc-02"
  }]
}