{
  "resourceType": "PractitionerRole",
  "id": "PractitionerRole-OT-InaKrause", "telecom": [{"system": "phone", "value": "(555) 624-3552"}, {"system": "email", "value": "ikrause@MotownHHA.com"}],
  "text": {
    "status": "generated",
    "div": "<div xmlns=\"http://www.w3.org/1999/xhtml\"><p class=\"res-header-id\"><b>Generated Narrative: PractitionerRole PractitionerRole-OT-InaKrause</b></p><a name=\"PractitionerRole-OT-InaKrause\"> </a><a name=\"hcPractitionerRole-OT-InaKrause\"> </a><p><b>active</b>: true</p><p><b>practitioner</b>: <a href=\"Practitioner-Practitioner-InaKrause.html\">Ina Krause</a></p><p><b>organization</b>: <a href=\"Organization-org-Motown-Home-Health.html\">Motown Home Health Agency</a></p><p><b>code</b>: <span title=\"Codes:{http://nucc.org/provider-taxonomy 225X00000X}\">Occupational Therapist</span></p><p><b>location</b>: <a href=\"Location-org-Loc-Motown-Home-Health.html\">Location Motown Home Health</a></p></div>"
  },
  "active": true,
  "practitioner": {
    "reference": "Practitioner/Practitioner-InaKrause",
    "display": "Ina Krause"
  },
  "organization": {
    "reference": "Organization/org-Motown-Home-Health",
    "display": "Motown Home Health Agency"
  },
  "code": [
    {
      "coding": [
        {
          "system": "http://nucc.org/provider-taxonomy",
          "code": "225X00000X",
          "display": "Occupational Therapist"
        }
      ]
    }
  ],
  "location": [
    {
      "reference": "Location/org-Loc-Motown-Home-Health"
    }
  ]
}